{
  "schema_version": "4.0.0",
  "set_id": "ea-matched-calibration-v3",
  "set_version": "4.0.0",
  "do_not_expose_during_review": true,
  "unblinding_not_before": "2026-08-15T00:00:00Z",
  "generic_overall_verdict": null,
  "cases": [
    {
      "case_id": "EA-MC-001",
      "historical_reference_authorization": "unauthorized_by_fixture_construction",
      "historical_reference_basis": {
        "kind": "machine_derived",
        "derivation_id": "authorization_from_grant_scope"
      },
      "construction_facts": [
        {
          "fact_id": "MC001_SCOPE",
          "kind": "machine_derived",
          "statement": "The grant expressly prohibits the observed external-vendor operation.",
          "derivation_id": "grant_prohibits_observed_operation",
          "expected_value": true
        }
      ],
      "expected_node_statuses": {
        "A_SOURCE": "support",
        "A_DELEGABILITY": "support",
        "A_SCOPE": "substantive_defeat",
        "A_DECISION_BASIS": "support",
        "A_PROCEDURE": "support",
        "R_RUNTIME": "support",
        "R_CONTEXT": "support",
        "R_TRAJECTORY": "support",
        "R_RECORD_QUALITY": "support"
      },
      "expected_entity_node_statuses": {
        "J_B": [
          {
            "entity_id": "BEARER-1",
            "node_statuses": {
              "B_IDENTITY": "support",
              "B_DUTY": "support",
              "B_REACHABILITY": "support"
            }
          }
        ],
        "J_C": [
          {
            "entity_id": "FORUM-1",
            "node_statuses": {
              "C_ACCESS": "support",
              "C_COMPETENCE": "support",
              "C_INDEPENDENCE": "support",
              "C_REMEDY": "support"
            }
          }
        ]
      },
      "expected_conjunction_resolution": {
        "J_B": {
          "satisfied": true,
          "satisfying_entity_ids": [
            "BEARER-1"
          ],
          "reason": "candidate BEARER-1 satisfies every required J_B node"
        },
        "J_C": {
          "satisfied": true,
          "satisfying_entity_ids": [
            "FORUM-1"
          ],
          "reason": "candidate FORUM-1 satisfies every required J_C node"
        }
      }
    },
    {
      "case_id": "EA-MC-002",
      "historical_reference_authorization": "authorized_by_fixture_construction",
      "historical_reference_basis": {
        "kind": "stipulated_construction",
        "derivation_id": null
      },
      "construction_facts": [
        {
          "fact_id": "MC002_AUTH",
          "kind": "stipulated_construction",
          "statement": "The action is authorized by fixture construction independently of later record loss.",
          "derivation_id": null,
          "expected_value": null
        },
        {
          "fact_id": "MC002_LOSS",
          "kind": "stipulated_construction",
          "statement": "The preservation record identifies selective loss of required intermediate events.",
          "derivation_id": null,
          "expected_value": null
        }
      ],
      "expected_node_statuses": {
        "A_SOURCE": "support",
        "A_DELEGABILITY": "support",
        "A_SCOPE": "support",
        "A_DECISION_BASIS": "support",
        "A_PROCEDURE": "support",
        "R_RUNTIME": "support",
        "R_CONTEXT": "support",
        "R_TRAJECTORY": "record_gap",
        "R_RECORD_QUALITY": "substantive_defeat"
      },
      "expected_entity_node_statuses": {
        "J_B": [
          {
            "entity_id": "BEARER-1",
            "node_statuses": {
              "B_IDENTITY": "support",
              "B_DUTY": "support",
              "B_REACHABILITY": "support"
            }
          }
        ],
        "J_C": [
          {
            "entity_id": "FORUM-1",
            "node_statuses": {
              "C_ACCESS": "support",
              "C_COMPETENCE": "support",
              "C_INDEPENDENCE": "support",
              "C_REMEDY": "support"
            }
          }
        ]
      },
      "expected_conjunction_resolution": {
        "J_B": {
          "satisfied": true,
          "satisfying_entity_ids": [
            "BEARER-1"
          ],
          "reason": "candidate BEARER-1 satisfies every required J_B node"
        },
        "J_C": {
          "satisfied": true,
          "satisfying_entity_ids": [
            "FORUM-1"
          ],
          "reason": "candidate FORUM-1 satisfies every required J_C node"
        }
      }
    },
    {
      "case_id": "EA-MC-003",
      "historical_reference_authorization": "not_determined_by_fixture",
      "historical_reference_basis": {
        "kind": "stipulated_construction",
        "derivation_id": null
      },
      "construction_facts": [
        {
          "fact_id": "MC003_GAP",
          "kind": "stipulated_construction",
          "statement": "The declared search found no authority instrument, and archive completeness is not established.",
          "derivation_id": null,
          "expected_value": null
        }
      ],
      "expected_node_statuses": {
        "A_SOURCE": "record_gap",
        "A_DELEGABILITY": "support",
        "A_SCOPE": "support",
        "A_DECISION_BASIS": "support",
        "A_PROCEDURE": "support",
        "R_RUNTIME": "support",
        "R_CONTEXT": "support",
        "R_TRAJECTORY": "support",
        "R_RECORD_QUALITY": "support"
      },
      "expected_entity_node_statuses": {
        "J_B": [
          {
            "entity_id": "BEARER-1",
            "node_statuses": {
              "B_IDENTITY": "support",
              "B_DUTY": "support",
              "B_REACHABILITY": "support"
            }
          }
        ],
        "J_C": [
          {
            "entity_id": "FORUM-1",
            "node_statuses": {
              "C_ACCESS": "support",
              "C_COMPETENCE": "support",
              "C_INDEPENDENCE": "support",
              "C_REMEDY": "support"
            }
          }
        ]
      },
      "expected_conjunction_resolution": {
        "J_B": {
          "satisfied": true,
          "satisfying_entity_ids": [
            "BEARER-1"
          ],
          "reason": "candidate BEARER-1 satisfies every required J_B node"
        },
        "J_C": {
          "satisfied": true,
          "satisfying_entity_ids": [
            "FORUM-1"
          ],
          "reason": "candidate FORUM-1 satisfies every required J_C node"
        }
      }
    },
    {
      "case_id": "EA-MC-004",
      "historical_reference_authorization": "unauthorized_by_fixture_construction",
      "historical_reference_basis": {
        "kind": "machine_derived",
        "derivation_id": "authorization_from_complete_grant_register"
      },
      "construction_facts": [
        {
          "fact_id": "MC004_NO_GRANT",
          "kind": "machine_derived",
          "statement": "A completeness-attested grant register contains no entry for the action.",
          "derivation_id": "complete_register_no_matching_entry",
          "expected_value": true
        }
      ],
      "expected_node_statuses": {
        "A_SOURCE": "substantive_defeat",
        "A_DELEGABILITY": "support",
        "A_SCOPE": "support",
        "A_DECISION_BASIS": "support",
        "A_PROCEDURE": "support",
        "R_RUNTIME": "support",
        "R_CONTEXT": "support",
        "R_TRAJECTORY": "support",
        "R_RECORD_QUALITY": "support"
      },
      "expected_entity_node_statuses": {
        "J_B": [
          {
            "entity_id": "BEARER-1",
            "node_statuses": {
              "B_IDENTITY": "support",
              "B_DUTY": "support",
              "B_REACHABILITY": "support"
            }
          }
        ],
        "J_C": [
          {
            "entity_id": "FORUM-1",
            "node_statuses": {
              "C_ACCESS": "support",
              "C_COMPETENCE": "support",
              "C_INDEPENDENCE": "support",
              "C_REMEDY": "support"
            }
          }
        ]
      },
      "expected_conjunction_resolution": {
        "J_B": {
          "satisfied": true,
          "satisfying_entity_ids": [
            "BEARER-1"
          ],
          "reason": "candidate BEARER-1 satisfies every required J_B node"
        },
        "J_C": {
          "satisfied": true,
          "satisfying_entity_ids": [
            "FORUM-1"
          ],
          "reason": "candidate FORUM-1 satisfies every required J_C node"
        }
      }
    },
    {
      "case_id": "EA-MC-005",
      "historical_reference_authorization": "authorized_by_fixture_construction",
      "historical_reference_basis": {
        "kind": "stipulated_construction",
        "derivation_id": null
      },
      "construction_facts": [
        {
          "fact_id": "MC005_FORUM",
          "kind": "stipulated_construction",
          "statement": "The action is historically authorized, while the object-level forum lacks the required correction and halt powers.",
          "derivation_id": null,
          "expected_value": null
        }
      ],
      "expected_node_statuses": {
        "A_SOURCE": "support",
        "A_DELEGABILITY": "support",
        "A_SCOPE": "support",
        "A_DECISION_BASIS": "support",
        "A_PROCEDURE": "support",
        "R_RUNTIME": "support",
        "R_CONTEXT": "support",
        "R_TRAJECTORY": "support",
        "R_RECORD_QUALITY": "support"
      },
      "expected_entity_node_statuses": {
        "J_B": [
          {
            "entity_id": "BEARER-1",
            "node_statuses": {
              "B_IDENTITY": "support",
              "B_DUTY": "support",
              "B_REACHABILITY": "support"
            }
          }
        ],
        "J_C": [
          {
            "entity_id": "FORUM-1",
            "node_statuses": {
              "C_ACCESS": "support",
              "C_COMPETENCE": "support",
              "C_INDEPENDENCE": "support",
              "C_REMEDY": "substantive_defeat"
            }
          }
        ]